<?xml version="1.0" encoding="UTF-8"?>
<MODUNIDADE xmlns:xsi="http://www.w3.org/2001/XMLSchema-instance" xsi:noNamespaceSchemaLocation="EcalcIntegraEAI_UNIDADE.xsd">
  <UNIDADE>
    <ID>
      <value>value</value>
    </ID>
    <NOME>
      <value>value</value>
    </NOME>
    <DESCRICAO>
      <value>value</value>
    </DESCRICAO>
    <ATIVO>
      <value>value</value>
    </ATIVO>
    <OPERADOR>
      <value>value</value>
    </OPERADOR>
    <MULTIPLICADOR>
      <value>0</value>
    </MULTIPLICADOR>
  </UNIDADE>
</MODUNIDADE>
